{
  "manifest_version": "0.1.0-milestone2-installunits",
  "generated_at": "2026-08-17T05:52:15Z",
  "shadow_commit": "efbc732e99432773158322adf47c93e5bd447518",
  "targets": [
    {
      "stable_hook_id": "dyld",
      "source": {
        "file": "Shadow.framework/HookConfiguration.m",
        "line": 11
      },
      "role": "mandatory",
      "commit_domain": "phase_always",
      "required_reach": [
        "existing_imports"
      ],
      "original_requirement": "direct_predecessor",
      "continuation_policy": "any",
      "availability": "required_now",
      "extraction_method": "structured_table",
      "known_compatibility_risks": [
        "unit-level only: does not yet decompose into the individual function/selector targets this install unit installs"
      ],
      "target_kind": "function_symbol",
      "verification_method": "shdw verify function (ctor-run, see HookConfiguration.h SHDWInstallUnit.verify)"
    },
    {
      "stable_hook_id": "Hook_Filesystem@c",
      "source": {
        "file": "Shadow.framework/HookConfiguration.m",
        "line": 12
      },
      "role": "optional",
      "commit_domain": "phase_tier1",
      "required_reach": [
        "existing_imports"
      ],
      "original_requirement": "direct_predecessor",
      "continuation_policy": "any",
      "availability": "required_now",
      "extraction_method": "structured_table",
      "known_compatibility_risks": [
        "unit-level only: does not yet decompose into the individual function/selector targets this install unit installs",
        "pref-gated by SHDWHookIDFilesystem"
      ],
      "target_kind": "function_symbol",
      "verification_method": "shdw verify function (ctor-run, see HookConfiguration.h SHDWInstallUnit.verify)"
    },
    {
      "stable_hook_id": "Hook_EnvVars@c",
      "source": {
        "file": "Shadow.framework/HookConfiguration.m",
        "line": 13
      },
      "role": "optional",
      "commit_domain": "phase_tier1",
      "required_reach": [
        "existing_imports"
      ],
      "original_requirement": "direct_predecessor",
      "continuation_policy": "any",
      "availability": "required_now",
      "extraction_method": "structured_table",
      "known_compatibility_risks": [
        "unit-level only: does not yet decompose into the individual function/selector targets this install unit installs",
        "pref-gated by SHDWHookIDEnvVars"
      ],
      "target_kind": "function_symbol",
      "verification_method": "shdw verify function (ctor-run, see HookConfiguration.h SHDWInstallUnit.verify)"
    },
    {
      "stable_hook_id": "Hook_EnvVars@objc",
      "source": {
        "file": "Shadow.framework/HookConfiguration.m",
        "line": 14
      },
      "role": "optional",
      "commit_domain": "phase_tier1",
      "required_reach": [
        "objc_dispatch"
      ],
      "original_requirement": "direct_predecessor",
      "continuation_policy": "any",
      "availability": "required_now",
      "extraction_method": "structured_table",
      "known_compatibility_risks": [
        "unit-level only: does not yet decompose into the individual function/selector targets this install unit installs",
        "pref-gated by SHDWHookIDEnvVars"
      ],
      "target_kind": "objc_method"
    },
    {
      "stable_hook_id": "Hook_DeviceCheck",
      "source": {
        "file": "Shadow.framework/HookConfiguration.m",
        "line": 15
      },
      "role": "optional",
      "commit_domain": "phase_tier1",
      "required_reach": [
        "objc_dispatch"
      ],
      "original_requirement": "direct_predecessor",
      "continuation_policy": "any",
      "availability": "required_now",
      "extraction_method": "structured_table",
      "known_compatibility_risks": [
        "unit-level only: does not yet decompose into the individual function/selector targets this install unit installs",
        "pref-gated by SHDWHookIDDeviceCheck"
      ],
      "target_kind": "objc_method"
    },
    {
      "stable_hook_id": "Hook_MachBootstrap",
      "source": {
        "file": "Shadow.framework/HookConfiguration.m",
        "line": 16
      },
      "role": "optional",
      "commit_domain": "phase_tier1",
      "required_reach": [
        "existing_imports"
      ],
      "original_requirement": "direct_predecessor",
      "continuation_policy": "any",
      "availability": "required_now",
      "extraction_method": "structured_table",
      "known_compatibility_risks": [
        "unit-level only: does not yet decompose into the individual function/selector targets this install unit installs",
        "pref-gated by SHDWHookIDMachBootstrap"
      ],
      "target_kind": "function_symbol",
      "verification_method": "shdw verify function (ctor-run, see HookConfiguration.h SHDWInstallUnit.verify)"
    },
    {
      "stable_hook_id": "Hook_IOKit",
      "source": {
        "file": "Shadow.framework/HookConfiguration.m",
        "line": 17
      },
      "role": "optional",
      "commit_domain": "phase_tier1",
      "required_reach": [
        "existing_imports"
      ],
      "original_requirement": "direct_predecessor",
      "continuation_policy": "any",
      "availability": "required_now",
      "extraction_method": "structured_table",
      "known_compatibility_risks": [
        "unit-level only: does not yet decompose into the individual function/selector targets this install unit installs",
        "pref-gated by SHDWHookIDIOKit"
      ],
      "target_kind": "function_symbol",
      "verification_method": "shdw verify function (ctor-run, see HookConfiguration.h SHDWInstallUnit.verify)"
    },
    {
      "stable_hook_id": "Hook_LowLevelC",
      "source": {
        "file": "Shadow.framework/HookConfiguration.m",
        "line": 18
      },
      "role": "optional",
      "commit_domain": "phase_tier1",
      "required_reach": [
        "existing_imports"
      ],
      "original_requirement": "direct_predecessor",
      "continuation_policy": "any",
      "availability": "required_now",
      "extraction_method": "structured_table",
      "known_compatibility_risks": [
        "unit-level only: does not yet decompose into the individual function/selector targets this install unit installs",
        "pref-gated by SHDWHookIDLowLevelC"
      ],
      "target_kind": "function_symbol",
      "verification_method": "shdw verify function (ctor-run, see HookConfiguration.h SHDWInstallUnit.verify)"
    },
    {
      "stable_hook_id": "Hook_AntiDebugging",
      "source": {
        "file": "Shadow.framework/HookConfiguration.m",
        "line": 19
      },
      "role": "optional",
      "commit_domain": "phase_tier1",
      "required_reach": [
        "existing_imports"
      ],
      "original_requirement": "direct_predecessor",
      "continuation_policy": "any",
      "availability": "required_now",
      "extraction_method": "structured_table",
      "known_compatibility_risks": [
        "unit-level only: does not yet decompose into the individual function/selector targets this install unit installs",
        "pref-gated by SHDWHookIDAntiDebugging"
      ],
      "target_kind": "function_symbol",
      "verification_method": "shdw verify function (ctor-run, see HookConfiguration.h SHDWInstallUnit.verify)"
    },
    {
      "stable_hook_id": "objc",
      "source": {
        "file": "Shadow.framework/HookConfiguration.m",
        "line": 20
      },
      "role": "mandatory",
      "commit_domain": "phase_always",
      "required_reach": [
        "objc_dispatch"
      ],
      "original_requirement": "direct_predecessor",
      "continuation_policy": "any",
      "availability": "required_now",
      "extraction_method": "structured_table",
      "known_compatibility_risks": [
        "unit-level only: does not yet decompose into the individual function/selector targets this install unit installs"
      ],
      "target_kind": "objc_method"
    },
    {
      "stable_hook_id": "objc@methodimpl",
      "source": {
        "file": "Shadow.framework/HookConfiguration.m",
        "line": 23
      },
      "role": "mandatory",
      "commit_domain": "phase_always",
      "required_reach": [
        "existing_imports"
      ],
      "original_requirement": "direct_predecessor",
      "continuation_policy": "any",
      "availability": "required_now",
      "extraction_method": "structured_table",
      "known_compatibility_risks": [
        "unit-level only: does not yet decompose into the individual function/selector targets this install unit installs"
      ],
      "target_kind": "function_symbol"
    },
    {
      "stable_hook_id": "Hook_Syscall",
      "source": {
        "file": "Shadow.framework/HookConfiguration.m",
        "line": 24
      },
      "role": "optional",
      "commit_domain": "phase_tier1",
      "required_reach": [
        "existing_imports"
      ],
      "original_requirement": "direct_predecessor",
      "continuation_policy": "any",
      "availability": "required_now",
      "extraction_method": "structured_table",
      "known_compatibility_risks": [
        "unit-level only: does not yet decompose into the individual function/selector targets this install unit installs",
        "pref-gated by SHDWHookIDSyscall"
      ],
      "target_kind": "function_symbol",
      "verification_method": "shdw verify function (ctor-run, see HookConfiguration.h SHDWInstallUnit.verify)"
    },
    {
      "stable_hook_id": "Hook_Memory",
      "source": {
        "file": "Shadow.framework/HookConfiguration.m",
        "line": 25
      },
      "role": "optional",
      "commit_domain": "phase_tier1",
      "required_reach": [
        "existing_imports"
      ],
      "original_requirement": "direct_predecessor",
      "continuation_policy": "any",
      "availability": "required_now",
      "extraction_method": "structured_table",
      "known_compatibility_risks": [